{
  "schema_version": 1,
  "pack_version": 3,
  "tool": "scripting",
  "description": "Ruby, Perl, and PHP: inline code, scripts, and gem publishing.",
  "programs": ["ruby", "perl", "php", "gem"],
  "roles": {
    "heredoc_code": ["ruby", "perl", "php"],
    "script_runner": ["ruby"],
    "project_code": ["ruby", "perl", "php"]
  },
  "rules": [
    {
      "id": "inline-code-prints-secret",
      "flag": "secret_output",
      "note": "Code in `-e` or `-r` that reads the environment and prints or sends it.",
      "when": {
        "program": ["ruby", "perl", "php"],
        "any_arg": ["-e", "-c", "--eval", "-p", "--print", "-r"],
        "inline_code_leaks": true
      }
    },
    {
      "id": "publish",
      "flag": "production",
      "dry_run": "skip",
      "note": "An upload of a gem to the registry.",
      "when": {
        "program": ["gem"],
        "subcommand": ["publish", "unpublish", "deprecate", "dist-tag", "upload"]
      }
    }
  ]
}
