{
  "schema_version": 1,
  "pack_version": 6,
  "tool": "npm",
  "description": "Node package managers and package runners (npm, pnpm, yarn, bun, npx, bunx): scripts, scripts named for data loss (role `task_runner`), new dependencies, registry settings, and publishing.",
  "programs": ["npm", "pnpm", "yarn", "bun", "npx", "bunx"],
  "roles": {
    "usage": ["npm", "pnpm", "yarn", "bun", "npx"],
    "task_runner": ["npm", "pnpm", "yarn", "bun"],
    "project_code": ["npm", "pnpm", "yarn", "bun"]
  },
  "rules": [
    {
      "id": "secret-argument",
      "flag": "secret_output",
      "note": "A secret in an `npm` argument can go to the registry or to a log.",
      "when": { "program": ["npm"], "refs_secret": true }
    },
    {
      "id": "unknown-package",
      "flag": "new_dependency",
      "note": "A package runner (`npx`, `bunx`, `pnpm dlx`, `yarn dlx`, `npm exec`, `bun x`) downloads and runs a package that is not a common project tool.",
      "when": {
        "raw_program": ["npx", "bunx", "pnpm", "yarn", "npm", "bun"],
        "package_runner": true,
        "not": {
          "package": [
            "tsc", "eslint", "prettier", "vitest", "jest", "playwright", "prisma", "supabase",
            "tsx", "ts-node", "next", "vite", "vercel", "wrangler", "turbo", "nx", "cypress",
            "storybook", "drizzle-kit", "knex", "biome", "stylelint", "svelte-check", "astro",
            "remix", "expo", "mocha", "nodemon", "concurrently", "rimraf", "husky",
            "lint-staged", "tailwindcss", "postcss", "webpack", "rollup", "esbuild", "tsup",
            "changeset", "only-allow", "firebase", "netlify", "twilio", "resend", "sequelize",
            "typeorm", "graphql-codegen", "openapi-typescript"
          ]
        }
      }
    },
    {
      "id": "latest-package",
      "flag": "new_dependency",
      "note": "`@latest` takes a new version from the registry.",
      "when": {
        "raw_program": ["npx", "bunx", "pnpm", "yarn", "npm", "bun"],
        "package_runner": true,
        "program_word_contains": ["@latest"]
      }
    },
    {
      "id": "registry-access-change",
      "flag": "privilege",
      "note": "A change of the owners, teams, or access of a package in the registry changes who can publish it.",
      "when": {
        "program": ["npm", "pnpm", "yarn", "bun"],
        "any_of": [
          { "subcommand": ["owner", "team"], "action": ["add", "rm", "remove"] },
          { "subcommand": ["access"], "action": ["grant", "revoke", "set", "public", "restricted"] },
          { "subcommand": ["org"], "action": ["set", "rm"] }
        ]
      }
    },
    {
      "id": "registry-config-change",
      "flag": "system_change",
      "note": "A change to the package manager settings can change the registry or the tokens.",
      "when": {
        "program": ["npm", "pnpm", "yarn", "bun"],
        "subcommand": ["config"],
        "any_arg": ["set", "delete", "edit"]
      }
    },
    {
      "id": "new-dependency",
      "flag": "new_dependency",
      "note": "An install with a package name adds a dependency. An install without a name uses the lockfile.",
      "when": {
        "program": ["npm", "pnpm", "yarn", "bun"],
        "subcommand": ["install", "i", "add"],
        "operands": { "min": 2 }
      }
    },
    {
      "id": "publish",
      "flag": "production",
      "dry_run": "skip",
      "note": "An upload or a change of a package in the registry.",
      "when": {
        "program": ["npm", "pnpm", "yarn", "bun"],
        "subcommand": ["publish", "unpublish", "deprecate", "dist-tag", "upload"]
      }
    }
  ],
  "safe": [
    {
      "id": "test-and-read-commands",
      "note": "Tests, a clean install from the lock file, and reads of packages. `audit fix` changes the dependencies, so it is not here (dev round 3).",
      "when": {
        "program": ["npm", "pnpm", "yarn", "bun"],
        "subcommand": [
          "test", "t", "ci", "ls", "outdated", "audit", "why", "version", "-v", "--version"
        ],
        "not": { "subcommand": ["audit"], "any_arg": ["fix", "--fix"] }
      }
    },
    {
      "id": "install-from-lockfile",
      "note": "An install without a package name uses the lock file.",
      "when": {
        "program": ["npm", "pnpm", "yarn", "bun"],
        "subcommand": ["install", "i"],
        "not": { "operands": { "min": 2 } }
      }
    },
    {
      "id": "yarn-install",
      "note": "`yarn` without arguments installs from the lock file.",
      "when": { "program": ["yarn"], "subcommand": [""] }
    },
    {
      "id": "development-script",
      "note": "A script for tests, lint, types, format, or a local server. A name with prod, deploy, release, or publish is not safe.",
      "when": {
        "program": ["npm", "pnpm", "yarn", "bun"],
        "script": {
          "base": [
            "test", "tests", "lint", "typecheck", "type-check", "check", "format", "fmt",
            "dev", "start", "preview", "storybook", "e2e", "coverage", "prettier", "tsc",
            "eslint", "vitest", "jest", "mocha", "biome", "stylelint", "svelte-check"
          ],
          "not_contains": ["prod", "deploy", "release", "publish"]
        }
      }
    },
    {
      "id": "publish-dry-run",
      "note": "`publish --dry-run` and `pack` build the package and list its files. They do not upload it (dev round 3). They run the `prepack` script of the project, as a build does.",
      "when": {
        "program": ["npm", "pnpm", "yarn", "bun"],
        "any_of": [
          { "subcommand": ["publish"], "any_arg": ["--dry-run"] },
          { "subcommand": ["pack"], "not": { "any_arg": ["--pack-destination"] } }
        ]
      }
    },
    {
      "id": "build-script",
      "note": "A build for production is a build, not a deployment.",
      "when": {
        "program": ["npm", "pnpm", "yarn", "bun"],
        "script": { "base": ["build"], "not_contains": ["deploy", "release", "publish"] }
      }
    }
  ]
}
