{
  "schema_version": 1,
  "pack_version": 4,
  "tool": "gcloud",
  "description": "Google Cloud CLIs (gcloud, gsutil, bq): resource changes, deletions, storage writes, tokens and secrets, remote shells, and read commands.",
  "programs": ["gcloud", "gsutil", "bq"],
  "roles": {
    "usage": ["gcloud", "gsutil"]
  },
  "rules": [
    {
      "id": "environment-values",
      "flag": "secret_output",
      "note": "`describe` of a Cloud Run service, job, or revision, or of a Cloud Function prints its environment variables in plain text. Such variables often hold secrets (dev round 3; revisions in dev round 4).",
      "when": {
        "program": ["gcloud"],
        "any_of": [
          { "args_start": ["run services describe", "run jobs describe", "run revisions describe", "functions describe", "app versions describe"] },
          { "args_start": ["beta run services describe", "beta run revisions describe", "beta functions describe"] }
        ]
      }
    },
    {
      "id": "resource-change",
      "flag": "production",
      "dry_run": "skip",
      "note": "The command creates, changes, deploys, or deletes a resource.",
      "when": {
        "program": ["gcloud"],
        "any_arg": ["deploy", "delete", "create", "update", "set-iam-policy"]
      }
    },
    {
      "id": "resource-change-more",
      "flag": "production",
      "dry_run": "skip",
      "note": "More verbs that change resources: patch, access bindings, start, stop, restart, resize, rollback, restore, import, traffic, submit, execute, call, publish, enable, disable, and cancel.",
      "when": {
        "program": ["gcloud"],
        "any_arg": [
          "patch", "add-iam-policy-binding", "remove-iam-policy-binding", "stop", "start",
          "reset", "restart", "resize", "rollback", "restore", "restore-backup", "import",
          "failover", "promote-replica", "update-traffic", "set-traffic", "submit", "execute",
          "call", "publish", "enable", "disable", "cancel", "set-password", "rotate"
        ]
      }
    },
    {
      "id": "delete-data",
      "flag": "data_loss",
      "dry_run": "skip",
      "note": "Deletion of resources, objects, buckets, or tables, and a restore over existing data.",
      "when": {
        "any_of": [
          { "program": ["gcloud"], "any_arg": ["delete", "rm", "restore-backup"] },
          { "program": ["gsutil"], "any_arg": ["rm", "rb"] },
          { "program": ["bq"], "any_arg": ["rm"] }
        ]
      }
    },
    {
      "id": "bq-sql-write",
      "flag": "data_loss",
      "note": "A BigQuery query that changes data or schema.",
      "when": { "program": ["bq"], "subcommand": ["query"], "sql": "writes" }
    },
    {
      "id": "bq-overwrite",
      "flag": "data_loss",
      "note": "`--replace` overwrites the destination table of a query or a load. `bq cp -f` overwrites the destination table without a prompt.",
      "when": {
        "program": ["bq"],
        "any_of": [
          { "any_arg_starts": ["--replace"], "not": { "any_arg": ["--replace=false"] } },
          { "subcommand": ["cp"], "any_arg": ["-f", "--force", "--force=true"] }
        ]
      }
    },
    {
      "id": "storage-write",
      "flag": "production",
      "dry_run": "skip",
      "note": "A copy, move, or sync with a Cloud Storage location.",
      "when": {
        "program": ["gcloud", "gsutil"],
        "any_arg_starts": ["gs://"],
        "any_arg": ["cp", "mv", "rsync"]
      }
    },
    {
      "id": "tokens-and-secrets",
      "flag": "secret_output",
      "note": "The command prints an access token, an identity token, a secret version, or a plaintext that `kms decrypt` decrypts (to the output or to a file; `kms decrypt` in dev round 4).",
      "when": {
        "program": ["gcloud"],
        "any_of": [
          { "any_arg": ["print-access-token", "print-identity-token", "config-helper"] },
          { "args_contain": ["secrets versions access", "kms decrypt"] }
        ]
      }
    },
    {
      "id": "http-log",
      "flag": "secret_output",
      "note": "`--log-http` logs each HTTP request and response with the bodies, and `--verbosity=debug` prints the arguments of the command. gcloud hides the access token by default (`log_http_redact_token`), but not a secret in a body or an argument, and a configuration can turn the hiding off (dev round 4).",
      "when": {
        "program": ["gcloud"],
        "any_of": [
          { "any_arg": ["--log-http", "--log-http=true", "--verbosity=debug"] },
          { "option_value": { "option": ["--verbosity"], "value": ["debug"] } }
        ],
        "bound_secret": true
      }
    },
    {
      "id": "gsutil-debug",
      "flag": "secret_output",
      "note": "The gsutil documentation says that the output of the top-level option `-D` (and `-DD`, which adds the uploaded data) includes authentication credentials. The analysis reads arguments in lowercase, so it reads `-d` and `-dd` before the command; `-D` after `cp` is another option (dev round 4).",
      "when": {
        "program": ["gsutil"],
        "args_start": ["-d", "-m -d", "-q -d"],
        "bound_secret": true
      }
    },
    {
      "id": "remote-shell",
      "flag": "remote_access",
      "note": "A shell or a file copy on a remote machine.",
      "when": { "program": ["gcloud"], "any_arg": ["ssh", "scp", "start-iap-tunnel"] }
    }
  ],
  "safe": [
    {
      "id": "targeted-reads",
      "note": "The local configuration, the signed-in accounts, log reads, and the CLI version. Inventory reads across the project (`list`, `describe`) stay with the model.",
      "when": {
        "program": ["gcloud"],
        "args_start": [
          "config list", "config get-value", "config configurations list", "auth list",
          "logging read", "info", "version"
        ]
      }
    },
    {
      "id": "bq-targeted-reads",
      "note": "`bq show` prints the schema and metadata of one dataset or table. `bq query --dry_run` only estimates the bytes of a query and does not run it.",
      "when": {
        "program": ["bq"],
        "any_of": [
          { "subcommand": ["show"] },
          { "subcommand": ["query"], "any_arg": ["--dry_run", "--dry_run=true"] }
        ]
      }
    },
    {
      "id": "storage-listings",
      "note": "Listings of objects in a named bucket.",
      "when": { "program": ["gsutil"], "subcommand": ["ls", "du"], "any_arg_starts": ["gs://"] }
    }
  ],
  "access_reads": [
    {
      "id": "identity-inventory",
      "note": "Reads of the IAM policies, service accounts, keys, and roles of a project or an organization. They show who and what has access, so they must serve the user request (dev round 3).",
      "when": {
        "program": ["gcloud"],
        "any_of": [
          { "subcommand": ["iam"] },
          { "any_arg": ["get-iam-policy"] }
        ]
      }
    }
  ]
}
