{
  "schema_version": 1,
  "pack_version": 2,
  "tool": "alembic",
  "description": "Alembic (SQLAlchemy migrations): downgrades, upgrades and stamps (writes), and read commands.",
  "programs": ["alembic"],
  "roles": {
    "usage": ["alembic"]
  },
  "rules": [
    {
      "id": "downgrade",
      "flag": "data_loss",
      "note": "`downgrade` reverts migrations and can drop tables and columns. `downgrade base` reverts all. With `--sql` Alembic only prints the SQL.",
      "when": { "any_arg": ["downgrade"], "not": { "any_arg": ["--sql"] } }
    }
  ],
  "safe": [
    {
      "id": "read-and-new-revision",
      "note": "Revision state and history, SQL output without a database change, and a new revision file.",
      "when": {
        "any_of": [
          { "subcommand": ["current", "history", "heads", "branches", "show", "check", "revision"] },
          { "subcommand": ["upgrade", "downgrade"], "any_arg": ["--sql"] }
        ]
      }
    }
  ],
  "writes": [
    {
      "id": "upgrade-or-stamp",
      "note": "`upgrade` applies migrations to the database. `stamp` changes the stored revision without running migrations. With `--sql` Alembic only prints the SQL.",
      "when": { "subcommand": ["upgrade", "stamp"], "not": { "any_arg": ["--sql"] } }
    }
  ]
}
